{
  "$schema": "https://json-schema.org/draft/2020-12/schema",
  "$ref": "#/$defs/Preset",
  "$defs": {
    "Preset": {
      "type": "object",
      "properties": {
        "schemaVersion": {
          "$ref": "#/$defs/__schema0"
        },
        "id": {
          "$ref": "#/$defs/__schema1"
        },
        "label": {
          "$ref": "#/$defs/__schema2"
        },
        "description": {
          "$ref": "#/$defs/__schema3"
        },
        "tokens": {
          "$ref": "#/$defs/__schema4"
        }
      },
      "required": [
        "schemaVersion",
        "id",
        "label",
        "description",
        "tokens"
      ],
      "additionalProperties": {
        "$ref": "#/$defs/__schema11"
      },
      "propertyNames": {
        "not": {
          "enum": [
            "__proto__",
            "constructor",
            "prototype"
          ]
        }
      }
    },
    "__schema0": {
      "type": "number",
      "const": 1
    },
    "__schema1": {
      "type": "string",
      "minLength": 1,
      "maxLength": 48,
      "pattern": "^[a-z][a-z0-9]*(?:-[a-z0-9]+)*$"
    },
    "__schema2": {
      "type": "string",
      "minLength": 1,
      "maxLength": 80
    },
    "__schema3": {
      "type": "string",
      "minLength": 1,
      "maxLength": 512
    },
    "__schema4": {
      "maxItems": 500,
      "type": "array",
      "items": {
        "$ref": "#/$defs/Token"
      }
    },
    "Token": {
      "type": "object",
      "properties": {
        "name": {
          "$ref": "#/$defs/__schema5"
        },
        "category": {
          "$ref": "#/$defs/__schema6"
        },
        "value": {
          "$ref": "#/$defs/__schema7"
        },
        "dark": {
          "$ref": "#/$defs/__schema8"
        },
        "label": {
          "$ref": "#/$defs/__schema9"
        }
      },
      "required": [
        "name",
        "category",
        "value"
      ],
      "additionalProperties": {
        "$ref": "#/$defs/__schema10"
      },
      "propertyNames": {
        "not": {
          "enum": [
            "__proto__",
            "constructor",
            "prototype"
          ]
        }
      }
    },
    "__schema5": {
      "type": "string",
      "minLength": 1,
      "maxLength": 48,
      "pattern": "^[a-z][a-z0-9]*(?:-[a-z0-9]+)*$"
    },
    "__schema6": {
      "type": "string",
      "enum": [
        "color",
        "font-family",
        "font-size",
        "spacing",
        "radius",
        "container",
        "shadow"
      ]
    },
    "__schema7": {
      "type": "string",
      "minLength": 1,
      "maxLength": 512
    },
    "__schema8": {
      "type": "string",
      "minLength": 1,
      "maxLength": 512
    },
    "__schema9": {
      "type": "string",
      "minLength": 1,
      "maxLength": 80
    },
    "__schema10": {},
    "__schema11": {}
  },
  "$id": "urn:blixis:wp-blocks:preset:1",
  "title": "Blixis design preset",
  "description": "Generated from packages/design-tokens/src/schema.ts (do not edit). Shape only: CSS value grammars, unique names and references are checked by validateTokenSet in @blixis/wp-style-engine; contrast is checked by checkPresetAccessibility."
}
