{
  "schemaVersion": 1,
  "id": "sunset",
  "label": "Sunset",
  "description": "Warm terracotta and amber.",
  "tokens": [
    {
      "name": "color-bg",
      "category": "color",
      "value": "#fffaf5",
      "dark": "#24140f",
      "label": "Background"
    },
    {
      "name": "color-surface",
      "category": "color",
      "value": "#fff0e2",
      "dark": "#352019",
      "label": "Surface"
    },
    {
      "name": "color-text",
      "category": "color",
      "value": "#3d2019",
      "dark": "#fff0e5",
      "label": "Text"
    },
    {
      "name": "color-muted",
      "category": "color",
      "value": "#765044",
      "dark": "#ddbead",
      "label": "Muted text"
    },
    {
      "name": "color-link",
      "category": "color",
      "value": "#9a3412",
      "dark": "#fdba74",
      "label": "Link"
    },
    {
      "name": "color-primary",
      "category": "color",
      "value": "#9a3412",
      "dark": "#fdba74",
      "label": "Primary"
    },
    {
      "name": "color-on-primary",
      "category": "color",
      "value": "#ffffff",
      "dark": "#40200b",
      "label": "On primary"
    },
    {
      "name": "color-line",
      "category": "color",
      "value": "#9a7366",
      "dark": "#ad8975",
      "label": "Border"
    },
    {
      "name": "font-body",
      "category": "font-family",
      "value": "system-ui, -apple-system, \"Segoe UI\", Roboto, sans-serif",
      "label": "System sans"
    },
    {
      "name": "font-heading",
      "category": "font-family",
      "value": "system-ui, -apple-system, \"Segoe UI\", Roboto, sans-serif",
      "label": "System heading"
    },
    {
      "name": "text-sm",
      "category": "font-size",
      "value": "0.875rem",
      "label": "Small"
    },
    {
      "name": "text-base",
      "category": "font-size",
      "value": "1rem",
      "label": "Base"
    },
    {
      "name": "text-lg",
      "category": "font-size",
      "value": "1.25rem",
      "label": "Large"
    },
    {
      "name": "text-xl",
      "category": "font-size",
      "value": "1.5rem",
      "label": "Extra large"
    },
    {
      "name": "text-2xl",
      "category": "font-size",
      "value": "2rem",
      "label": "Display"
    },
    {
      "name": "space-1",
      "category": "spacing",
      "value": "0.25rem",
      "label": "1"
    },
    {
      "name": "space-2",
      "category": "spacing",
      "value": "0.5rem",
      "label": "2"
    },
    {
      "name": "space-3",
      "category": "spacing",
      "value": "0.75rem",
      "label": "3"
    },
    {
      "name": "space-4",
      "category": "spacing",
      "value": "1rem",
      "label": "4"
    },
    {
      "name": "space-6",
      "category": "spacing",
      "value": "1.5rem",
      "label": "6"
    },
    {
      "name": "space-8",
      "category": "spacing",
      "value": "2rem",
      "label": "8"
    },
    {
      "name": "radius-sm",
      "category": "radius",
      "value": "0.25rem",
      "label": "Small"
    },
    {
      "name": "radius-md",
      "category": "radius",
      "value": "0.5rem",
      "label": "Medium"
    },
    {
      "name": "container-content",
      "category": "container",
      "value": "45rem",
      "label": "Content"
    },
    {
      "name": "container-wide",
      "category": "container",
      "value": "72rem",
      "label": "Wide"
    },
    {
      "name": "shadow-card",
      "category": "shadow",
      "value": "0 2px 8px rgb(0 0 0 / 0.12)",
      "label": "Card"
    }
  ]
}
